{
  "$schema": "http://json-schema.org/draft-07/schema#",
  "type": "array",
  "items": {
    "type": "object",
    "required": ["id", "date", "headline", "excerpt", "url", "source", "metals", "strategies", "lever", "actors", "impact", "tagStatus"],
    "additionalProperties": false,
    "properties": {
      "id": { "type": "string" },
      "date": { "type": "string" },
      "headline": { "type": "string" },
      "excerpt": { "type": "string" },
      "url": { "type": "string" },
      "source": { "type": "string" },
      "metals": { "type": "array", "items": { "type": "string" } },
      "strategies": { "type": "array", "items": { "type": "string" } },
      "lever": { "type": "string" },
      "actors": { "type": "array", "items": { "type": "string" } },
      "impact": { "type": "integer", "minimum": -3, "maximum": 3 },
      "tagStatus": { "type": "string", "enum": ["proposed", "reviewed"] }
    }
  }
}
